id,submission_time,vote_number,question_id,message,image
13,1622136972.7474108,0,5,I swear by Vicks VapoRub! I applied a small amount to the affected area at least once a day. It worked wonders.,wick.jpeg
14,1622137165.4235487,0,5,"Snakeroot extract worked for me. A 2008 study showed that snakeroot extract is as effective against toenail fungus as the prescription antifungal medicine ciclopirox. Apply it to the affected area every third day for the first month, twice a week for the second month, and once a week for the third month.",snakeroot.jpg
15,1622137420.0145018,0,5,Try tea tree oil. Paint the tea tree oil directly onto the affected nail twice daily with a cotton swab.,teatreeoil.jpeg
16,1622137539.4478097,0,5,"Oregano oil contains thymol. According to a 2016 review, thymol has antifungal and antibacterial properties. Treatment: apply oregano oil to the nail twice daily with a cotton swab.",oreganooil.jpeg
17,1622137714.7797399,0,5,My aunt used vinegar for her toenail fungus. She soaked her foot in one part vinegar to two parts warm water for 20 minutes daily and it worked for her.,vinegar.jpg
